{
  "$schema": "https://json-schema.org/draft/2020-12/schema",
  "$id": "release-manifest.schema.json",
  "title": "GamePatchKit release manifest",
  "description": "Canonical JSON artifact generated by the Packager; never hand-authored. files[] fully and exactly represents the final logical file state of the release (added/changed/deleted history lives only in a separate build report, never here). manifestHash is the SHA-256 of these exact canonical bytes with no manifestHash field present, so this schema intentionally never defines a manifestHash property. Reference integrity (group/artifact/bundle-entry existence, part contiguity, content-addressed path reconstruction) and canonical array ordering are Core semantic validation (ManifestValidator), not expressed by this schema.",
  "type": "object",
  "additionalProperties": false,
  "required": ["schemaVersion", "packageId", "dataVersion", "compactVersion", "groups", "artifacts", "files"],
  "properties": {
    "schemaVersion": {
      "const": 1
    },
    "packageId": {
      "$ref": "#/$defs/kebabCaseId"
    },
    "dataVersion": {
      "type": "string",
      "pattern": "^v1-[0-9a-f]{64}$",
      "description": "'v1-' followed by the lowercase hex64 SHA-256 of the canonical identity bytes (packageId, group logical policy, and each file's normalized path/group/size/fileHash). Excludes artifact kind, bundle boundaries, compression, artifact paths/parts, compactVersion, and manifestHash. The 'v1-' prefix distinguishes dataVersion from the bare-hex manifestHash/fileHash/artifactHash family so the two are never confused at a glance."
    },
    "compactVersion": {
      "type": "integer",
      "minimum": 0,
      "maximum": 9007199254740991,
      "description": "Physical packaging generation. 0 for the initial package; inherited by incremental packages; incremented only when a compact changes physical artifact layout. Excluded from dataVersion."
    },
    "groups": {
      "type": "array",
      "items": {
        "$ref": "#/$defs/manifestGroup"
      },
      "description": "Canonical order: group name, ascending ordinal UTF-8 byte order."
    },
    "artifacts": {
      "type": "array",
      "items": {
        "$ref": "#/$defs/artifact"
      },
      "description": "Canonical order: content-addressed artifact path, ascending ordinal UTF-8 byte order."
    },
    "files": {
      "type": "array",
      "items": {
        "$ref": "#/$defs/fileEntry"
      },
      "description": "Canonical order: normalized relative path, ascending ordinal UTF-8 byte order. Represents the complete final file state; deleted files are simply absent."
    }
  },
  "$defs": {
    "kebabCaseId": {
      "type": "string",
      "pattern": "^[a-z0-9]+(-[a-z0-9]+)*$"
    },
    "hex64": {
      "type": "string",
      "pattern": "^[0-9a-f]{64}$"
    },
    "normalizedRelativePath": {
      "type": "string",
      "minLength": 1,
      "description": "Core-normalized relative path: '/' separators, NFC form, no absolute path, empty segment, '.', '..', backslash, or NUL. Exact grammar and canonical-form-already-applied checks are enforced by Core, not by this pattern."
    },
    "byteSize": {
      "type": "integer",
      "minimum": 0,
      "maximum": 9007199254740991
    },
    "manifestGroup": {
      "type": "object",
      "additionalProperties": false,
      "required": ["name", "required"],
      "properties": {
        "name": {
          "$ref": "#/$defs/kebabCaseId"
        },
        "required": {
          "type": "boolean"
        }
      }
    },
    "compressionMetadata": {
      "description": "Describes the actual payload format of one artifact. Independent per artifact: two artifacts in the same release and group may carry different compression metadata.",
      "oneOf": [
        {
          "type": "object",
          "additionalProperties": false,
          "required": ["kind"],
          "properties": {
            "kind": {
              "const": "none"
            }
          }
        },
        {
          "type": "object",
          "additionalProperties": false,
          "required": ["kind", "codecId"],
          "properties": {
            "kind": {
              "const": "zstd"
            },
            "codecId": {
              "const": "zstd"
            }
          }
        }
      ]
    },
    "filePart": {
      "type": "object",
      "additionalProperties": false,
      "required": ["index", "path", "size", "partHash"],
      "properties": {
        "index": {
          "type": "integer",
          "minimum": 0,
          "maximum": 9007199254740991,
          "description": "0-based; parts[] must be contiguous starting at 0 (Core semantic validation)."
        },
        "path": {
          "$ref": "#/$defs/normalizedRelativePath"
        },
        "size": {
          "$ref": "#/$defs/byteSize"
        },
        "partHash": {
          "$ref": "#/$defs/hex64"
        }
      }
    },
    "filePayload": {
      "oneOf": [
        {
          "type": "object",
          "additionalProperties": false,
          "required": ["kind", "path", "size", "artifactHash"],
          "properties": {
            "kind": {
              "const": "single"
            },
            "path": {
              "$ref": "#/$defs/normalizedRelativePath"
            },
            "size": {
              "$ref": "#/$defs/byteSize"
            },
            "artifactHash": {
              "$ref": "#/$defs/hex64"
            }
          }
        },
        {
          "type": "object",
          "additionalProperties": false,
          "required": ["kind", "size", "artifactHash", "parts"],
          "properties": {
            "kind": {
              "const": "parts"
            },
            "size": {
              "$ref": "#/$defs/byteSize",
              "description": "Total size of the complete (pre-split) payload; must equal the sum of parts[].size. This is the physical payload size (post-compression, if compressed), not necessarily files[].size."
            },
            "artifactHash": {
              "$ref": "#/$defs/hex64",
              "description": "Hash of the complete (pre-split) payload, not any single part."
            },
            "parts": {
              "type": "array",
              "minItems": 1,
              "items": {
                "$ref": "#/$defs/filePart"
              }
            }
          }
        }
      ]
    },
    "bundleEntry": {
      "type": "object",
      "additionalProperties": false,
      "required": ["path"],
      "properties": {
        "path": {
          "$ref": "#/$defs/normalizedRelativePath",
          "description": "Full normalized relative path of the file as recorded inside the bundle archive. size/fileHash are not duplicated here; they are already recorded once on the corresponding files[] entry."
        }
      }
    },
    "artifact": {
      "oneOf": [
        {
          "type": "object",
          "additionalProperties": false,
          "required": ["kind", "compression", "payload"],
          "properties": {
            "kind": {
              "const": "file"
            },
            "compression": {
              "$ref": "#/$defs/compressionMetadata"
            },
            "payload": {
              "$ref": "#/$defs/filePayload"
            }
          }
        },
        {
          "type": "object",
          "additionalProperties": false,
          "required": ["kind", "group", "path", "size", "artifactHash", "compression", "entries"],
          "properties": {
            "kind": {
              "const": "bundle"
            },
            "group": {
              "$ref": "#/$defs/kebabCaseId",
              "description": "A bundle contains files from exactly one group."
            },
            "path": {
              "$ref": "#/$defs/normalizedRelativePath"
            },
            "size": {
              "$ref": "#/$defs/byteSize"
            },
            "artifactHash": {
              "$ref": "#/$defs/hex64",
              "description": "SHA-256 of the bundle payload bytes; also referred to as bundleHash."
            },
            "compression": {
              "$ref": "#/$defs/compressionMetadata"
            },
            "entries": {
              "type": "array",
              "minItems": 1,
              "items": {
                "$ref": "#/$defs/bundleEntry"
              },
              "description": "Canonical order: normalized entry path, ascending ordinal UTF-8 byte order."
            }
          }
        }
      ]
    },
    "fileSource": {
      "oneOf": [
        {
          "type": "object",
          "additionalProperties": false,
          "required": ["kind", "artifactHash"],
          "properties": {
            "kind": {
              "const": "file"
            },
            "artifactHash": {
              "$ref": "#/$defs/hex64",
              "description": "Must reference an artifacts[] entry with kind=file."
            }
          }
        },
        {
          "type": "object",
          "additionalProperties": false,
          "required": ["kind", "artifactHash", "entryPath"],
          "properties": {
            "kind": {
              "const": "bundleEntry"
            },
            "artifactHash": {
              "$ref": "#/$defs/hex64",
              "description": "Must reference an artifacts[] entry with kind=bundle."
            },
            "entryPath": {
              "$ref": "#/$defs/normalizedRelativePath",
              "description": "Must match one of that bundle's entries[].path."
            }
          }
        }
      ]
    },
    "fileEntry": {
      "type": "object",
      "additionalProperties": false,
      "required": ["path", "group", "size", "fileHash", "source"],
      "properties": {
        "path": {
          "$ref": "#/$defs/normalizedRelativePath"
        },
        "group": {
          "$ref": "#/$defs/kebabCaseId",
          "description": "Must reference a declared groups[] entry."
        },
        "size": {
          "$ref": "#/$defs/byteSize",
          "description": "Original (pre-compression) byte size of the file."
        },
        "fileHash": {
          "$ref": "#/$defs/hex64",
          "description": "SHA-256 of the original file bytes."
        },
        "source": {
          "$ref": "#/$defs/fileSource"
        }
      }
    }
  }
}
