{"artifacts":[{"artifactHash":"34fd11640cef8bb04218acfa66ebca39481bb9e7b17b5ffcbada5ed720a19e6c","compression":{"kind":"none"},"entries":[{"path":"maps/level1.bin"}],"group":"maps","kind":"bundle","path":"golden-bundle-entry/artifacts/bundles/maps/34fd11640cef8bb04218acfa66ebca39481bb9e7b17b5ffcbada5ed720a19e6c.tar","size":512}],"compactVersion":0,"dataVersion":"v1-447ae7d265c45868cb72e295a1701f5990b28adb53108a50c4efdb20a5f0efd0","files":[{"fileHash":"22faad9315c7ad20e8d6b370258cacf8039de80805268ef047087841e9078c05","group":"maps","path":"maps/level1.bin","size":14,"source":{"artifactHash":"34fd11640cef8bb04218acfa66ebca39481bb9e7b17b5ffcbada5ed720a19e6c","entryPath":"maps/level1.bin","kind":"bundleEntry"}}],"groups":[{"name":"maps","required":false}],"packageId":"golden-bundle-entry","schemaVersion":1}