{"artifacts":[{"artifactHash":"34fd11640cef8bb04218acfa66ebca39481bb9e7b17b5ffcbada5ed720a19e6c","compression":{"kind":"none"},"entries":[{"path":"optional-assets/level1.bin"}],"group":"optional-assets","kind":"bundle","path":"golden-mixed/artifacts/bundles/optional-assets/34fd11640cef8bb04218acfa66ebca39481bb9e7b17b5ffcbada5ed720a19e6c.tar","size":512},{"compression":{"kind":"none"},"kind":"file","payload":{"artifactHash":"30fdb670837e4a2ae265f0ba5bf332a6c80930274f43b7e3cf799b637eaff1c6","kind":"single","path":"golden-mixed/artifacts/files/30fdb670837e4a2ae265f0ba5bf332a6c80930274f43b7e3cf799b637eaff1c6/content","size":14}},{"compression":{"codecId":"zstd","kind":"zstd"},"kind":"file","payload":{"artifactHash":"f932608e42632d2607d7d540a1e1d70e752ba192823e69e9eed0d4d307ff45d8","kind":"parts","parts":[{"index":0,"partHash":"2dc778fd7c0bf27cda8936092f7fd981515c4f5bbf3f3d082211462f12f3060e","path":"golden-mixed/artifacts/files/f932608e42632d2607d7d540a1e1d70e752ba192823e69e9eed0d4d307ff45d8/part-00000","size":12},{"index":1,"partHash":"d8588ec425bb08feffaf3f8725f0bd497f7d82f5f940fd1c3578a6c4e8529284","path":"golden-mixed/artifacts/files/f932608e42632d2607d7d540a1e1d70e752ba192823e69e9eed0d4d307ff45d8/part-00001","size":8}],"size":20}}],"compactVersion":0,"dataVersion":"v1-9b6bf50ba6a0034b27fd53fd450a01ad3f2e79a145c7ed75f26289c7531b9866","files":[{"fileHash":"30fdb670837e4a2ae265f0ba5bf332a6c80930274f43b7e3cf799b637eaff1c6","group":"core","path":"core/config.json","size":14,"source":{"artifactHash":"30fdb670837e4a2ae265f0ba5bf332a6c80930274f43b7e3cf799b637eaff1c6","kind":"file"}},{"fileHash":"cd43d82673a50ede733a204a3db6997dd349fb9963ee34950682433e97b1b512","group":"optional-assets","path":"optional-assets/big.bin","size":28,"source":{"artifactHash":"f932608e42632d2607d7d540a1e1d70e752ba192823e69e9eed0d4d307ff45d8","kind":"file"}},{"fileHash":"22faad9315c7ad20e8d6b370258cacf8039de80805268ef047087841e9078c05","group":"optional-assets","path":"optional-assets/level1.bin","size":14,"source":{"artifactHash":"34fd11640cef8bb04218acfa66ebca39481bb9e7b17b5ffcbada5ed720a19e6c","entryPath":"optional-assets/level1.bin","kind":"bundleEntry"}}],"groups":[{"name":"core","required":true},{"name":"optional-assets","required":false}],"packageId":"golden-mixed","schemaVersion":1}