{"artifacts":[{"compression":{"codecId":"zstd","kind":"zstd"},"kind":"file","payload":{"artifactHash":"f932608e42632d2607d7d540a1e1d70e752ba192823e69e9eed0d4d307ff45d8","kind":"parts","parts":[{"index":0,"partHash":"2dc778fd7c0bf27cda8936092f7fd981515c4f5bbf3f3d082211462f12f3060e","path":"golden-multipart-file/artifacts/files/f932608e42632d2607d7d540a1e1d70e752ba192823e69e9eed0d4d307ff45d8/part-00000","size":12},{"index":1,"partHash":"d8588ec425bb08feffaf3f8725f0bd497f7d82f5f940fd1c3578a6c4e8529284","path":"golden-multipart-file/artifacts/files/f932608e42632d2607d7d540a1e1d70e752ba192823e69e9eed0d4d307ff45d8/part-00001","size":8}],"size":20}}],"compactVersion":0,"dataVersion":"v1-d105929f7f99190a31576b2f68d12709c2a150936c6b30804ba2852ede4d8e29","files":[{"fileHash":"cd43d82673a50ede733a204a3db6997dd349fb9963ee34950682433e97b1b512","group":"core","path":"data/big-file.bin","size":28,"source":{"artifactHash":"f932608e42632d2607d7d540a1e1d70e752ba192823e69e9eed0d4d307ff45d8","kind":"file"}}],"groups":[{"name":"core","required":true}],"packageId":"golden-multipart-file","schemaVersion":1}