{"artifacts":[{"compression":{"kind":"none"},"kind":"file","payload":{"artifactHash":"30fdb670837e4a2ae265f0ba5bf332a6c80930274f43b7e3cf799b637eaff1c6","kind":"single","path":"golden-single-file/artifacts/files/30fdb670837e4a2ae265f0ba5bf332a6c80930274f43b7e3cf799b637eaff1c6/content","size":14}}],"compactVersion":0,"dataVersion":"v1-a382501f1e5bed87b530c56cf9c1b1a63e363fd328ea7882bf66553c248421aa","files":[{"fileHash":"30fdb670837e4a2ae265f0ba5bf332a6c80930274f43b7e3cf799b637eaff1c6","group":"core","path":"data/config.json","size":14,"source":{"artifactHash":"30fdb670837e4a2ae265f0ba5bf332a6c80930274f43b7e3cf799b637eaff1c6","kind":"file"}}],"groups":[{"name":"core","required":true}],"packageId":"golden-single-file","schemaVersion":1}